{
    "schemaVersion": "2.0",
    "boundary": "FORMAL_TURN_VALIDATION_INPUT",
    "projectId": "wp04",
    "sessionId": "wp04-session-1",
    "turnId": "wp04-turn-1",
    "contextId": "wp04-context-1",
    "contextHash": "wp04-context-hash-v2",
    "turnNumber": 1,
    "baseStateVersion": 0,
    "resultId": "wp04-evidence-result-1",
    "resultCanonicalSha256": "d85f6239327a0c55362f8d778d4b8964ca9289c7c7d6befaa043ac1574d36013",
    "physicalStateVersion": 0,
    "physicalSnapshotCanonicalSha256": "8714be9991de736e3d3be353392c3a86b624c4127ca9d8e7e1132a71f4b422b0",
    "physicalArchetypeRegistryCanonicalSha256": "d3707f597411ac3bcff573ddb82b85fc1cce294ed031c5e17d7249342d2cbae2",
    "physicalArchetypes": [
        {
            "archetypeId": "adult-human",
            "entityKind": "ACTOR",
            "bodyPlan": "ADULT_HUMANOID",
            "massKg": 70.0,
            "dimensionsCm": {
                "width": 45.0,
                "depth": 30.0,
                "height": 175.0
            },
            "movable": true,
            "canGrasp": true,
            "maxReachCm": 75.0,
            "maxLiftKg": 30.0,
            "maxPushKg": 120.0,
            "supportSurfaces": [],
            "containerInteriorCm": null,
            "openingCm": null,
            "maxContainedLoadKg": null
        },
        {
            "archetypeId": "child-human",
            "entityKind": "ACTOR",
            "bodyPlan": "CHILD_HUMANOID",
            "massKg": 25.0,
            "dimensionsCm": {
                "width": 35.0,
                "depth": 25.0,
                "height": 120.0
            },
            "movable": true,
            "canGrasp": true,
            "maxReachCm": 50.0,
            "maxLiftKg": 8.0,
            "maxPushKg": 30.0,
            "supportSurfaces": [],
            "containerInteriorCm": null,
            "openingCm": null,
            "maxContainedLoadKg": null
        },
        {
            "archetypeId": "medium-dog",
            "entityKind": "ACTOR",
            "bodyPlan": "CANINE_QUADRUPED",
            "massKg": 18.0,
            "dimensionsCm": {
                "width": 30.0,
                "depth": 80.0,
                "height": 55.0
            },
            "movable": true,
            "canGrasp": false,
            "maxReachCm": 25.0,
            "maxLiftKg": 5.0,
            "maxPushKg": 15.0,
            "supportSurfaces": [
                {
                    "surfaceId": "shoulder",
                    "stable": false,
                    "maxLoadKg": 8.0,
                    "widthCm": 20.0,
                    "depthCm": 30.0,
                    "allowedUses": [
                        "LIGHT_CONTACT"
                    ],
                    "allowedBodyPlans": [
                        "CANINE_QUADRUPED"
                    ]
                }
            ],
            "containerInteriorCm": null,
            "openingCm": null,
            "maxContainedLoadKg": null
        },
        {
            "archetypeId": "chair",
            "entityKind": "OBJECT",
            "bodyPlan": "FURNITURE",
            "massKg": 7.0,
            "dimensionsCm": {
                "width": 55.0,
                "depth": 55.0,
                "height": 90.0
            },
            "movable": true,
            "canGrasp": false,
            "maxReachCm": 0.0,
            "maxLiftKg": 0.0,
            "maxPushKg": 0.0,
            "supportSurfaces": [
                {
                    "surfaceId": "arm",
                    "stable": true,
                    "maxLoadKg": 80.0,
                    "widthCm": 20.0,
                    "depthCm": 40.0,
                    "allowedUses": [
                        "LIGHT_CONTACT",
                        "STAND_UP_ASSIST"
                    ],
                    "allowedBodyPlans": []
                }
            ],
            "containerInteriorCm": null,
            "openingCm": null,
            "maxContainedLoadKg": null
        },
        {
            "archetypeId": "rail",
            "entityKind": "OBJECT",
            "bodyPlan": "FIXED_STRUCTURE",
            "massKg": 60.0,
            "dimensionsCm": {
                "width": 10.0,
                "depth": 100.0,
                "height": 100.0
            },
            "movable": false,
            "canGrasp": false,
            "maxReachCm": 0.0,
            "maxLiftKg": 0.0,
            "maxPushKg": 0.0,
            "supportSurfaces": [
                {
                    "surfaceId": "rail",
                    "stable": true,
                    "maxLoadKg": 150.0,
                    "widthCm": 10.0,
                    "depthCm": 100.0,
                    "allowedUses": [
                        "LIGHT_CONTACT",
                        "STAND_UP_ASSIST"
                    ],
                    "allowedBodyPlans": []
                }
            ],
            "containerInteriorCm": null,
            "openingCm": null,
            "maxContainedLoadKg": null
        },
        {
            "archetypeId": "light-crate",
            "entityKind": "OBJECT",
            "bodyPlan": "RIGID_BOX",
            "massKg": 10.0,
            "dimensionsCm": {
                "width": 30.0,
                "depth": 30.0,
                "height": 30.0
            },
            "movable": true,
            "canGrasp": false,
            "maxReachCm": 0.0,
            "maxLiftKg": 0.0,
            "maxPushKg": 0.0,
            "supportSurfaces": [],
            "containerInteriorCm": null,
            "openingCm": null,
            "maxContainedLoadKg": null
        },
        {
            "archetypeId": "heavy-crate",
            "entityKind": "OBJECT",
            "bodyPlan": "RIGID_BOX",
            "massKg": 80.0,
            "dimensionsCm": {
                "width": 60.0,
                "depth": 60.0,
                "height": 60.0
            },
            "movable": true,
            "canGrasp": false,
            "maxReachCm": 0.0,
            "maxLiftKg": 0.0,
            "maxPushKg": 0.0,
            "supportSurfaces": [],
            "containerInteriorCm": null,
            "openingCm": null,
            "maxContainedLoadKg": null
        },
        {
            "archetypeId": "statue",
            "entityKind": "OBJECT",
            "bodyPlan": "FIXED_STRUCTURE",
            "massKg": 200.0,
            "dimensionsCm": {
                "width": 60.0,
                "depth": 60.0,
                "height": 200.0
            },
            "movable": false,
            "canGrasp": false,
            "maxReachCm": 0.0,
            "maxLiftKg": 0.0,
            "maxPushKg": 0.0,
            "supportSurfaces": [],
            "containerInteriorCm": null,
            "openingCm": null,
            "maxContainedLoadKg": null
        },
        {
            "archetypeId": "anvil",
            "entityKind": "OBJECT",
            "bodyPlan": "RIGID_OBJECT",
            "massKg": 160.0,
            "dimensionsCm": {
                "width": 60.0,
                "depth": 40.0,
                "height": 60.0
            },
            "movable": true,
            "canGrasp": false,
            "maxReachCm": 0.0,
            "maxLiftKg": 0.0,
            "maxPushKg": 0.0,
            "supportSurfaces": [],
            "containerInteriorCm": null,
            "openingCm": null,
            "maxContainedLoadKg": null
        },
        {
            "archetypeId": "table",
            "entityKind": "OBJECT",
            "bodyPlan": "FURNITURE",
            "massKg": 40.0,
            "dimensionsCm": {
                "width": 100.0,
                "depth": 60.0,
                "height": 80.0
            },
            "movable": false,
            "canGrasp": false,
            "maxReachCm": 0.0,
            "maxLiftKg": 0.0,
            "maxPushKg": 0.0,
            "supportSurfaces": [
                {
                    "surfaceId": "top",
                    "stable": true,
                    "maxLoadKg": 100.0,
                    "widthCm": 100.0,
                    "depthCm": 60.0,
                    "allowedUses": [
                        "OBJECT_PLACEMENT"
                    ],
                    "allowedBodyPlans": []
                }
            ],
            "containerInteriorCm": null,
            "openingCm": null,
            "maxContainedLoadKg": null
        },
        {
            "archetypeId": "narrow-shelf",
            "entityKind": "OBJECT",
            "bodyPlan": "FIXED_STRUCTURE",
            "massKg": 20.0,
            "dimensionsCm": {
                "width": 20.0,
                "depth": 20.0,
                "height": 120.0
            },
            "movable": false,
            "canGrasp": false,
            "maxReachCm": 0.0,
            "maxLiftKg": 0.0,
            "maxPushKg": 0.0,
            "supportSurfaces": [
                {
                    "surfaceId": "shelf",
                    "stable": true,
                    "maxLoadKg": 100.0,
                    "widthCm": 20.0,
                    "depthCm": 20.0,
                    "allowedUses": [
                        "OBJECT_PLACEMENT"
                    ],
                    "allowedBodyPlans": []
                }
            ],
            "containerInteriorCm": null,
            "openingCm": null,
            "maxContainedLoadKg": null
        },
        {
            "archetypeId": "large-container",
            "entityKind": "CONTAINER",
            "bodyPlan": "RIGID_CONTAINER",
            "massKg": 50.0,
            "dimensionsCm": {
                "width": 100.0,
                "depth": 100.0,
                "height": 200.0
            },
            "movable": false,
            "canGrasp": false,
            "maxReachCm": 0.0,
            "maxLiftKg": 0.0,
            "maxPushKg": 0.0,
            "supportSurfaces": [],
            "containerInteriorCm": {
                "width": 80.0,
                "depth": 80.0,